{
  "scene_objective": "Establish Ben's private struggle with a wrongness in the Force that has been costing him for a week, culminating in a moment of undeniable failure in front of another Knight. This is the Setup phase hook: introduce the inciting problem through concrete physical consequence rather than exposition. Ben's lie is that he can handle this alone and that the disturbance is residual noise from recent crises. The scene plants the promise that the wrongness has a source and a direction.",
  "turning_point": {
    "trigger": "Alone in the salle after dismissing his sparring partner, Ben runs through forms without igniting the blade and feels the wrongness steal a beat he cannot spare\u2014a moment of muscle-memory failure that proves this is not fatigue or distraction.",
    "shift": "Ben stops pretending. The wrongness is real, structural, and affecting his Force perception in measurable ways. His internal narrative shifts from 'I can manage this privately' to 'this is a problem I cannot solve alone,' though he does not yet act on that knowledge.",
    "cost": "Ben's confidence in his own Force perception is fractured. He has always trusted his timing, his instincts, his ability to read the ambient field. That trust is now conditional. The cost is existential\u2014if he cannot trust his own senses, what remains reliable?"
  },
  "closing_beat": "Luke appeared in the doorway with a datapad and an expression Ben knew meant a mission.",
  "emotional_arc": {
    "start": "Restless unease\u2014Ben is aware something is wrong but compartmentalizing it, treating it as a private problem to be managed through discipline and solitude.",
    "shift": "Frustrated isolation\u2014the sparring failure forces acknowledgment that the wrongness is not containable through willpower alone. His body has betrayed the lie he has been telling himself.",
    "end": "Reluctant hope\u2014Luke's arrival offers a vector forward, though Ben does not yet know what that vector is. The hope is reluctant because it means admitting the problem to someone else, which Ben has been resisting."
  },
  "target_word_count": 1250,
  "opening_mode": "in_medias_res",
  "key_beats": [
    {
      "beat_description": "Ben's guard drops a half-second late during a training spar, and his partner's training blade catches him across the shoulder\u2014the third time this week the wrongness has cost him a beat he should never miss.",
      "state_change": "Ben is no longer alone with the problem. Another Knight has witnessed the failure, and the wrongness is now externally visible rather than privately managed.",
      "pov_reaction": "Ben's body registers the hit before his mind catches up\u2014a moment of disorientation where the impact lands in the wrong place in his timeline, as if his reflexes and the ambient field are no longer synchronized. His first impulse is to dismiss it, to offer a casual explanation (fatigue, distraction) that he does not believe but can perform. Underneath is a spike of something sharper: fear that the other Knight will ask questions he is not ready to answer."
    },
    {
      "beat_description": "Ben deactivates his training saber, waves off a rematch with a claim of fatigue, and watches his sparring partner accept the excuse and leave the salle.",
      "state_change": "Ben has successfully contained the moment\u2014the other Knight does not press, does not report, does not make it official. The wrongness remains private, but only barely.",
      "pov_reaction": "Relief and shame in the same breath. Ben is grateful the conversation ended, but the gratitude itself feels like a failure. He has always been the Knight who could handle pressure, who did not need to be managed or checked on. The lie he just told\u2014and the ease with which it was accepted\u2014sits wrong in his chest."
    },
    {
      "beat_description": "Alone in the empty salle, Ben runs through a form without igniting the blade, testing whether the wrongness disrupts muscle memory or Force timing. Midway through the sequence, the ambient field lags a half-beat behind his body's rhythm, and he loses the thread.",
      "state_change": "Ben can no longer attribute the wrongness to fatigue, distraction, or residual crisis-noise. It is structural, consistent, and measurable. It is real in a way that cannot be dismissed or managed privately.",
      "pov_reaction": "Ben's body goes still mid-form. The sensation is not pain or discomfort\u2014it is wrongness, a half-beat lag in the ambient field that his body has known by reflex for years. The lag is small enough that no one watching would notice, but Ben feels it like a note played slightly flat in a piece he has performed a thousand times. His hands want to keep moving, to push through, but his Force-sense is screaming that something is broken. The impulse to keep going\u2014to prove through sheer discipline that he can still do this\u2014wars with the knowledge that he cannot. He stops. He stands in the empty salle and admits, finally, that he does not know what is wrong or how to fix it."
    },
    {
      "beat_description": "Luke appears in the doorway with a datapad and mission-ready posture, his expression carrying the weight of something that requires Ben's attention.",
      "state_change": "Ben's private problem is about to become shared. Luke's arrival signals that the wrongness is no longer something Ben can handle alone\u2014whether because Luke has sensed it, discovered it through other means, or simply has a mission that will pull Ben into the larger picture.",
      "pov_reaction": "Ben's first reaction is a spike of defensiveness\u2014he is not ready to explain, not ready to admit that something is wrong with his Force perception. But underneath that is something else: relief. The decision has been taken out of his hands. He does not have to choose whether to tell Luke; Luke is already here, already moving, already treating this as something that requires action. Ben's reluctance to share the burden is about to be overridden by circumstance, and part of him\u2014the part that has been carrying this alone for a week\u2014is grateful for that."
    }
  ],
  "voice_guidance": "Channel Zahn's efficient close third-person interiority\u2014sharp, self-deprecating, never melodramatic. Ben's interior voice should read as a Knight thinking in real time, not a character narrating his own arc. His observations are tactical and sensory before they are emotional. When he feels the wrongness, he registers it as a physical phenomenon first (the half-beat lag, the note played flat) before allowing himself to name it as a problem. His self-criticism should be dry and immediate\u2014'the lie he just told sat wrong in his chest' rather than 'Ben felt a deep shame.' Dialogue with the sparring partner should be minimal and professional; the partner is background. The sensory details of the salle (humming sabers, sweat on palms, boot sounds on the floor, distant Temple corridors) should ground the scene in Coruscant as a lived place, not a backdrop. Ben's relationship to the Temple is one of long familiarity\u2014he knows the ambient Force presence of this space the way he knows his own breathing. When that presence lags, it is a violation of something fundamental.",
  "forbidden_moves": [
    "Do not open with a flashback or exposition about recent crises. The wrongness is introduced through immediate physical consequence, not explanation.",
    "Do not describe the wrongness in visual or color terms. Keep it auditory and vibrational\u2014the half-beat lag is the consistent metaphor for this scene.",
    "Do not have Ben arrive at any clinical articulation of what the wrongness is. He feels it; he does not diagnose it. The 'structural, not emotional' framing is a Part 3-4 voice, earned later.",
    "Do not lift any sentence of Ben's interiority that could be used in a mission debrief. His internal voice should be too immediate, too self-aware, too grounded in sensation to serve as exposition.",
    "Do not give the sparring partner significant characterization or dialogue beyond the minimum needed to provide physical context. This is not their scene.",
    "Do not have Ben make any decision to act on the wrongness by the scene's end. The turning point is acknowledgment, not action. Luke's arrival offers possibility, not resolution."
  ],
  "delivery_preferences": {
    "reveal_mode": "subtext",
    "exposition_budget": "none",
    "register_override": null
  },
  "required_hooks": [
    "H01"
  ],
  "required_subplots": [
    "SP-A",
    "SP3"
  ],
  "required_revelations": [],
  "anti_patterns": [
    "Do not describe the wrongness in visual or color terms\u2014keep it auditory and vibrational",
    "Do not have Ben arrive at any clinical articulation of what the wrongness is in this scene",
    "Do not lift sentences of interiority that could be used in a mission debrief\u2014keep interior voice immediate and sensory, not composed",
    "Do not open with a flashback or exposition about recent crises",
    "Do not give the sparring partner significant characterization\u2014minimal presence, exists for physical context only"
  ]
}