{
  "scene_objective": "In the setup phase, hook the reader by concretizing the planetary wrongness as Gavran's Fortress, forcing Ben into an environmental conflict where his modern Jedi training fails but his Skywalker bloodline heritage grants entry, committing the team to the unknown interior.",
  "turning_point": {
    "trigger": "The mechanism responds not to Ben's technique but to something older carried in his line — the Skywalker bloodline signature overrides the modern Jedi training that almost refused him entry.",
    "shift": "The amber hold goes green; the door concedes. The fortress acknowledges Ben as a legitimate heir to the Jedi Lords era, not as a contemporary Jedi.",
    "cost": "Ben enters a tomb sealed for a millennium with Desh's tactical assessment underscoring the defensible position and lack of extraction plan — personal threshold crossed into the unknown, team committed without retreat."
  },
  "closing_beat": "The entry opened. Inside, the air had not moved for a thousand years. The wrongness here was concentrated and shaped — channeled through the mountain itself. Something was alive in here.",
  "emotional_arc": {
    "start": "Awed caution — Ben approaches the fortress with reverence and wariness, feeling the weight of the wrongness but not yet understanding its source.",
    "shift": "Frustration with the lock — as the mechanism resists his modern technique, Ben's focus tightens into problem-solving urgency. The awed distance collapses into immediate tactical pressure.",
    "end": "Unsettled recognition — as the door opens and the ancient air spills out, Ben registers something older in the Force signature that the mechanism responded to. Recognition carries a note of displacement: he is not the Jedi he trained to be; he is something the fortress was built to admit."
  },
  "target_word_count": 1200,
  "opening_mode": "in_medias_res",
  "key_beats": [
    {
      "beat_description": "Ben and Desh trek across the thin-atmosphere plateau toward the fortress, breath steaming in the cold. The building reads as geology until the angles give it away — weathered stone and metal alloy, no Jedi symbols visible, built so precisely into the mountainside that only proximity reveals its artifice.",
      "state_change": "The abstract wrongness from earlier chapters becomes concrete geography. The fortress is real, localized, and waiting.",
      "pov_reaction": "Ben's breath burns slightly in the thin air; his lungs register the altitude as a low physical pressure. The awed caution manifests as a slowed approach — not hesitation, but the deliberate pace of someone entering a place that demands respect. His eyes track the angles, the patina on the stone, the way the structure breathes with the mountain."
    },
    {
      "beat_description": "Ben presses his palm against the entry mechanism. It resists — a subtle repulsion, like pressing against a held breath. The light pulses amber, scanning, rejecting. Ben tries again, reaching for the technique he was trained in, the modern Jedi signature. The amber deepens, holds, refuses.",
      "state_change": "The fortress actively rejects Ben's contemporary training. The mechanism is calibrated for an older era, and Ben's modern technique is not the key.",
      "pov_reaction": "Frustration arrives as a sharp physical sensation — the tightening of his jaw, the narrowing of his focus. Ben's hand stays pressed against the stone; he can feel the mechanism's pulse like a heartbeat under his palm. The awed distance collapses into immediate problem-solving."
    },
    {
      "beat_description": "Ben stops trying to impose his technique. He opens his palm flat against the mechanism and reaches deeper — not into the modern Jedi training, but into the older signature that lives in his bloodline. The amber light flickers, hesitates, then shifts to green. The mechanism concedes.",
      "state_change": "The fortress acknowledges Ben as a legitimate heir to the Jedi Lords era. The barrier that rejected modern technique accepts the older signature. The door is now permitted to open.",
      "pov_reaction": "The moment the light turns green, Ben feels something shift in the Force — not a dramatic surge, but a recognition. The wrongness here acknowledges him. The sensation is not comforting; it is unsettling in its specificity — a braced posture as his stance widens instinctively."
    },
    {
      "beat_description": "The fortress door grinds open, releasing sealed air that hasn't circulated in a thousand years. The sound is low and sustained, stone grinding against stone. Desh sweeps the entry corridor with a glow rod while Ben reaches into the Force ahead of them, feeling for movement, for presence, for the shape of the wrongness that has been concentrated here.",
      "state_change": "The threshold is crossed. The fortress interior is now accessible. The wrongness shifts from external pressure to an internal, shaped presence — concentrated, directional, moving through the rock like a held breath. Something is alive in here.",
      "pov_reaction": "Ben's breath catches as the ancient air spills out — it carries a weight that his lungs register immediately, a staleness that speaks of centuries of isolation. His hand drops from the mechanism; his shoulders tense into readiness."
    }
  ],
  "voice_guidance": "Channel Zahn's efficient page-turner pacing and tight third-person interiority — sharp sensory registration of Force wrongness as weight and shape (held breath through rock), never diagnostic or analytical; Allston-style humor-under-stress in Desh's tactical quips if they arise; commercial rhythm with short sentences in action beats, recycled-air staleness and durasteel cold in sensory palette; dialogue drives tactical exchanges, worldbuilding emerges in Desh's readouts.",
  "forbidden_moves": [
    "No retreat or extraction planning resolved here",
    "No theorizing about fortress purpose or Jedi Lords history"
  ],
  "delivery_preferences": {
    "reveal_mode": "gradual",
    "exposition_budget": "concise",
    "register_override": null
  },
  "required_hooks": [
    "H03"
  ],
  "required_subplots": [
    "SP-A"
  ],
  "required_revelations": [],
  "anti_patterns": [
    "Ben should not, in this scene, articulate what the fortress is",
    "no Jedi symbols visible on the exterior — the building's secrecy is a fact of its design, not an aesthetic choice narrated by Ben",
    "No Jedi symbols visible on the exterior — the building's secrecy is a fact of its design, not an aesthetic choice narrated by Ben",
    "Do not arrive at diagnostic-voice trap — Ben should not theorize about the fortress's purpose or the era that built it",
    "Do not use clinical articulation of the wrongness or the Force-wound — keep it sensory and shaped, not analytical",
    "Fortress should feel like a tomb before anyone says it is one",
    "No internal theorizing about era or purpose; pure sensory registration"
  ]
}